<?xml version="1.0" encoding="UTF-8"?>
<ETT-Descriptor xmlns:xsi="http://www.w3.org/2001/XMLSchema-instance" xsi:noNamespaceSchemaLocation="ETT-V2.xsd">
    <ETT-TimeTable days="4" hours="5">
        <ETT-Teachers>
            <ETT-Teacher id="1">
                <ETT-Name>Mika Rali</ETT-Name>
                <ETT-Teaching>
                    <ETT-Teaches subject-id="1"/>
                    <ETT-Teaches subject-id="2"/>
                </ETT-Teaching>
            </ETT-Teacher>
            <ETT-Teacher id="3">
                <ETT-Name>Maya Tzalach</ETT-Name>
                <ETT-Teaching>
                    <ETT-Teaches subject-id="3"/>
                </ETT-Teaching>
            </ETT-Teacher>
            <ETT-Teacher id="2">
                <ETT-Name>Mia Charon</ETT-Name>
                <ETT-Teaching>
                    <ETT-Teaches subject-id="2"/>
                    <ETT-Teaches subject-id="3"/>
                </ETT-Teaching>
            </ETT-Teacher>
            <ETT-Teacher id="4">
                <ETT-Name>Mati Knili</ETT-Name>
                <ETT-Teaching>
                    <ETT-Teaches subject-id="2"/>
                    <ETT-Teaches subject-id="4"/>
                </ETT-Teaching>
            </ETT-Teacher>
        </ETT-Teachers>
        <ETT-Subjects>
            <ETT-Subject id="1" name="Sifrut"/>
            <ETT-Subject id="3" name="Tanach"/>
            <ETT-Subject id="4" name="English"/>
            <ETT-Subject id="2" name="Math"/>
        </ETT-Subjects>
        <ETT-Classes>
            <ETT-Class id="1">
                <ETT-Name>Standart</ETT-Name>
                <ETT-Requirements>
                    <ETT-Study subject-id="1" hours="3"/>
                    <ETT-Study subject-id="2" hours="4"/>
                    <ETT-Study subject-id="3" hours="2"/>
                </ETT-Requirements>
            </ETT-Class>
            <ETT-Class id="2">
                <ETT-Name>Nerds</ETT-Name>
                <ETT-Requirements>
                    <ETT-Study subject-id="2" hours="6"/>
                    <ETT-Study subject-id="4" hours="6"/>
                </ETT-Requirements>
            </ETT-Class>
            <ETT-Class id="3">
                <ETT-Name>Tikshoret</ETT-Name>
                <ETT-Requirements>
                    <ETT-Study subject-id="4" hours="2"/>
                    <ETT-Study subject-id="1" hours="4"/>
                    <ETT-Study subject-id="3" hours="6"/>
                    <ETT-Study subject-id="2" hours="4"/>
                </ETT-Requirements>
            </ETT-Class>
            <ETT-Class id="4">
                <ETT-Name>Biologit</ETT-Name>
                <ETT-Requirements>
                    <ETT-Study subject-id="4" hours="2"/>
                    <ETT-Study subject-id="2" hours="4"/>
                </ETT-Requirements>
            </ETT-Class>
        </ETT-Classes>
        <ETT-Rules hard-rules-weight="70">
            <ETT-Rule type="Hard">
                <ETT-RuleId>TeacherIsHuman</ETT-RuleId>
            </ETT-Rule>
            <ETT-Rule type="Hard">
                <ETT-RuleId>Singularity</ETT-RuleId>
            </ETT-Rule>
            <ETT-Rule type="Hard">
                <ETT-RuleId>Knowledgeable</ETT-RuleId>
            </ETT-Rule>
            <ETT-Rule type="Hard">
                <ETT-RuleId>Satisfactory</ETT-RuleId>
            </ETT-Rule>
        </ETT-Rules>
    </ETT-TimeTable>
    <ETT-EvolutionEngine>
        <ETT-InitialPopulation size="100"/>
        <ETT-Selection type="Truncation" configuration="TopPercent=10">
            <ETT-Elitism>5</ETT-Elitism>
        </ETT-Selection>
        <ETT-Crossover name="AspectOriented" cutting-points="1" configuration="Orientation=CLASS"/>
        <ETT-Mutations>
            <ETT-Mutation name="Flipping" probability="0.2" configuration="MaxTupples=3,Component=D"/>
            <ETT-Mutation name="Sizer" probability="0.3" configuration="TotalTupples=7"/>
        </ETT-Mutations>
    </ETT-EvolutionEngine>
</ETT-Descriptor>
