<?xml version="1.0" encoding="UTF-8"?>
<ETT-Descriptor xmlns:xsi="http://www.w3.org/2001/XMLSchema-instance" xsi:noNamespaceSchemaLocation="ETT-V2.xsd">
    <ETT-TimeTable days="6" hours="8">
        <ETT-Teachers>
            <ETT-Teacher id="1">
                <ETT-Name>Alma Nedaber</ETT-Name>
                <ETT-Teaching>
                    <ETT-Teaches subject-id="1"/>
                    <ETT-Teaches subject-id="2"/>
                </ETT-Teaching>
            </ETT-Teacher>
            <ETT-Teacher id="3">
                <ETT-Name>Miki Peli</ETT-Name>
                <ETT-Teaching>
                    <ETT-Teaches subject-id="3"/>
                </ETT-Teaching>
            </ETT-Teacher>
            <ETT-Teacher id="2">
                <ETT-Name>Mali Vela</ETT-Name>
                <ETT-Teaching>
                    <ETT-Teaches subject-id="4"/>
                    <ETT-Teaches subject-id="5"/>
                </ETT-Teaching>
            </ETT-Teacher>
            <ETT-Teacher id="4">
                <ETT-Name>Lola Tet</ETT-Name>
                <ETT-Teaching>
                    <ETT-Teaches subject-id="6"/>
                    <ETT-Teaches subject-id="3"/>
                    <ETT-Teaches subject-id="7"/>
                </ETT-Teaching>
            </ETT-Teacher>
            <ETT-Teacher id="6">
                <ETT-Name>Tiki Pur</ETT-Name>
                <ETT-Teaching>
                    <ETT-Teaches subject-id="5"/>
                    <ETT-Teaches subject-id="1"/>
                    <ETT-Teaches subject-id="7"/>
                </ETT-Teaching>
            </ETT-Teacher>
            <ETT-Teacher id="5">
                <ETT-Name>Hugo Zer</ETT-Name>
                <ETT-Teaching>
                    <ETT-Teaches subject-id="1"/>
                    <ETT-Teaches subject-id="2"/>
                    <ETT-Teaches subject-id="3"/>
                    <ETT-Teaches subject-id="4"/>
                    <ETT-Teaches subject-id="5"/>
                    <ETT-Teaches subject-id="6"/>
                </ETT-Teaching>
            </ETT-Teacher>
        </ETT-Teachers>
        <ETT-Subjects>
            <ETT-Subject id="1" name="Sifrut"/>
            <ETT-Subject id="3" name="Tanach"/>
            <ETT-Subject id="4" name="English"/>
            <ETT-Subject id="5" name="Math"/>
            <ETT-Subject id="2" name="Physics"/>
            <ETT-Subject id="6" name="Tongue"/>
            <ETT-Subject id="7" name="Biology"/>
        </ETT-Subjects>
        <ETT-Classes>
            <ETT-Class id="1">
                <ETT-Name>Standart</ETT-Name>
                <ETT-Requirements>
                    <ETT-Study subject-id="1" hours="10"/>
                    <ETT-Study subject-id="3" hours="12"/>
                    <ETT-Study subject-id="6" hours="4"/>
                    <ETT-Study subject-id="5" hours="4"/>
                    <ETT-Study subject-id="2" hours="2"/>
                </ETT-Requirements>
            </ETT-Class>
            <ETT-Class id="2">
                <ETT-Name>Nerds</ETT-Name>
                <ETT-Requirements>
                    <ETT-Study subject-id="1" hours="2"/>
                    <ETT-Study subject-id="3" hours="2"/>
                    <ETT-Study subject-id="6" hours="4"/>
                    <ETT-Study subject-id="2" hours="12"/>
                    <ETT-Study subject-id="4" hours="12"/>
                    <ETT-Study subject-id="5" hours="12"/>
                </ETT-Requirements>
            </ETT-Class>
            <ETT-Class id="3">
                <ETT-Name>Tikshoret</ETT-Name>
                <ETT-Requirements>
                    <ETT-Study subject-id="1" hours="4"/>
                    <ETT-Study subject-id="3" hours="4"/>
                    <ETT-Study subject-id="6" hours="6"/>
                    <ETT-Study subject-id="2" hours="4"/>
                    <ETT-Study subject-id="4" hours="4"/>
                </ETT-Requirements>
            </ETT-Class>
            <ETT-Class id="4">
                <ETT-Name>Biologit</ETT-Name>
                <ETT-Requirements>
                    <ETT-Study subject-id="1" hours="2"/>
                    <ETT-Study subject-id="3" hours="2"/>
                    <ETT-Study subject-id="6" hours="4"/>
                    <ETT-Study subject-id="2" hours="6"/>
                    <ETT-Study subject-id="4" hours="6"/>
                    <ETT-Study subject-id="5" hours="6"/>
                    <ETT-Study subject-id="7" hours="12"/>
                </ETT-Requirements>
            </ETT-Class>
            <ETT-Class id="5">
                <ETT-Name>Science</ETT-Name>
                <ETT-Requirements>
                    <ETT-Study subject-id="1" hours="3"/>
                    <ETT-Study subject-id="3" hours="3"/>
                    <ETT-Study subject-id="6" hours="3"/>
                    <ETT-Study subject-id="2" hours="3"/>
                    <ETT-Study subject-id="4" hours="3"/>
                    <ETT-Study subject-id="5" hours="3"/>
                    <ETT-Study subject-id="7" hours="3"/>
                </ETT-Requirements>
            </ETT-Class>
        </ETT-Classes>
        <ETT-Rules hard-rules-weight="100">
            <ETT-Rule type="Hard">
                <ETT-RuleId>DayOffTeacher</ETT-RuleId>
            </ETT-Rule>
        </ETT-Rules>
    </ETT-TimeTable>
    <ETT-EvolutionEngine>
        <ETT-InitialPopulation size="150"/>
        <ETT-Selection type="Truncation" configuration="TopPercent=20"/>
        <ETT-Crossover name="DayTimeOriented" cutting-points="4"/>
        <ETT-Mutations>
            <ETT-Mutation name="Flipping" probability="0.4" configuration="MaxTupples=3,Component=D"/>
        </ETT-Mutations>
    </ETT-EvolutionEngine>
</ETT-Descriptor>
